{
  "schema_version": "0.0.1",
  "client_slug": "golden-books-only-mini",
  "currency": "MYR",
  "journals": [
    {
      "je_number": "JE-001",
      "date": "2025-01-01",
      "narration": "Opening balances",
      "source_ref": "prior_year_tb",
      "lines": [
        {
          "account_code": "1000",
          "account_name": "Cash & Bank",
          "debit": 10000.0,
          "credit": 0
        },
        {
          "account_code": "3000",
          "account_name": "Share Capital",
          "debit": 0,
          "credit": 10000.0
        }
      ]
    },
    {
      "je_number": "JE-002",
      "date": "2025-03-15",
      "narration": "Bank receipt - sales INV-001",
      "source_ref": "txn-001",
      "lines": [
        {
          "account_code": "1000",
          "account_name": "Cash & Bank",
          "debit": 5000.0,
          "credit": 0
        },
        {
          "account_code": "4000",
          "account_name": "Service Revenue - Primary",
          "debit": 0,
          "credit": 5000.0
        }
      ]
    },
    {
      "je_number": "JE-003",
      "date": "2025-04-01",
      "narration": "Bank payment - rent",
      "source_ref": "txn-002",
      "lines": [
        {
          "account_code": "5200",
          "account_name": "Rental Expense",
          "debit": 1000.0,
          "credit": 0
        },
        {
          "account_code": "1000",
          "account_name": "Cash & Bank",
          "debit": 0,
          "credit": 1000.0
        }
      ]
    },
    {
      "je_number": "JE-004",
      "date": "2025-04-28",
      "narration": "Bank payment - salary",
      "source_ref": "txn-003",
      "lines": [
        {
          "account_code": "5000",
          "account_name": "Salary & Wages",
          "debit": 2000.0,
          "credit": 0
        },
        {
          "account_code": "1000",
          "account_name": "Cash & Bank",
          "debit": 0,
          "credit": 2000.0
        }
      ]
    }
  ]
}
